{
  "id": "mock-ds4",
  "name": "Mock DS4",
  "version": "4.0",
  "description": "Mock design system for testing search functionality",
  "sourceUrl": "https://example.com/mock-ds4",
  "components": [
    {
      "id": "action",
      "name": "Action",
      "aliases": ["button", "btn"],
      "description": "Action trigger component",
      "category": "input",
      "previewUrl": "previews/mock-ds4/action.png",
      "html": "<div>this is mock</div>"
    },
    {
      "id": "form-field",
      "name": "FormField",
      "aliases": ["textfield", "input", "text-input"],
      "description": "Form input field",
      "category": "input",
      "previewUrl": "previews/mock-ds4/form-field.png",
      "html": "<div>this is mock</div>"
    },
    {
      "id": "picker",
      "name": "Picker",
      "aliases": ["dropdown", "select", "listbox"],
      "description": "Option picker component",
      "category": "input",
      "previewUrl": "previews/mock-ds4/picker.png",
      "html": "<div>this is mock</div>"
    },
    {
      "id": "badge-label",
      "name": "BadgeLabel",
      "aliases": ["chip", "tag", "pill"],
      "description": "Status badge component",
      "category": "display",
      "previewUrl": "previews/mock-ds4/badge-label.png",
      "html": "<div>this is mock</div>"
    },
    {
      "id": "popup",
      "name": "Popup",
      "aliases": ["dialog", "modal", "overlay dialog"],
      "description": "Popup dialog window",
      "category": "feedback",
      "previewUrl": "previews/mock-ds4/popup.png",
      "html": "<div>this is mock</div>"
    },
    {
      "id": "wizard",
      "name": "Wizard",
      "aliases": ["stepper", "multi-step"],
      "description": "Multi-step process component",
      "category": "navigation",
      "previewUrl": "previews/mock-ds4/wizard.png",
      "html": "<div>this is mock</div>"
    }
  ]
}
