{
  "id": "mui-v5",
  "name": "Material UI",
  "version": "5.15",
  "description": "React UI component library based on Google's Material Design",
  "sourceUrl": "https://mui.com/material-ui/",
  "components": [
    {
      "id": "button",
      "name": "Button",
      "aliases": ["btn", "cta", "action-button"],
      "description": "Buttons allow users to take actions and make choices with a single tap.",
      "category": "input",
      "previewUrl": "previews/mui-v5/button.png",
      "html": "<button style=\"display: inline-flex; align-items: center; justify-content: center; padding: 6px 16px; font-family: Roboto, sans-serif; font-size: 14px; font-weight: 500; line-height: 24px; letter-spacing: 0.4px; color: #ffffff; background-color: #1976d2; border: none; border-radius: 4px; text-transform: uppercase; cursor: pointer; min-width: 64px;\">Button</button>",
      "props": [
        {
          "name": "variant",
          "type": "enum",
          "description": "The visual style variant",
          "defaultValue": "contained",
          "values": [
            { "value": "contained" },
            { "value": "outlined" },
            { "value": "text" }
          ]
        },
        {
          "name": "size",
          "type": "enum",
          "description": "The button size",
          "defaultValue": "medium",
          "values": [
            { "value": "small" },
            { "value": "medium" },
            { "value": "large" }
          ]
        },
        {
          "name": "disabled",
          "type": "boolean",
          "description": "If true, the button is disabled",
          "defaultValue": "false"
        }
      ]
    },
    {
      "id": "textfield",
      "name": "TextField",
      "aliases": ["input", "text-input", "form-field"],
      "description": "Text fields let users enter and edit text.",
      "category": "input",
      "previewUrl": "previews/mui-v5/textfield.png",
      "html": "<div style=\"display: inline-flex; flex-direction: column; position: relative; min-width: 0; padding: 0; margin: 0; border: 0; vertical-align: top;\"><label style=\"color: rgba(0, 0, 0, 0.6); font-family: Roboto, sans-serif; font-weight: 400; font-size: 12px; line-height: 1.4375em; letter-spacing: 0.00938em; padding: 0; display: block; transform-origin: top left; white-space: nowrap; overflow: hidden; text-overflow: ellipsis; max-width: calc(100% - 24px); position: absolute; left: 0; top: 0; transform: translate(14px, -9px) scale(0.75); transition: color 200ms cubic-bezier(0.0, 0, 0.2, 1) 0ms, transform 200ms cubic-bezier(0.0, 0, 0.2, 1) 0ms, max-width 200ms cubic-bezier(0.0, 0, 0.2, 1) 0ms; z-index: 1; pointer-events: auto; user-select: none; background-color: #fff; padding-left: 5px; padding-right: 5px;\">Label</label><div style=\"font-family: Roboto, sans-serif; font-weight: 400; font-size: 16px; line-height: 1.4375em; letter-spacing: 0.00938em; color: rgba(0, 0, 0, 0.87); box-sizing: border-box; position: relative; cursor: text; display: inline-flex; align-items: center; border-radius: 4px; padding: 16.5px 14px;\"><input style=\"font: inherit; letter-spacing: inherit; color: currentColor; padding: 0; border: 0; box-sizing: content-box; background: none; height: 1.4375em; margin: 0; display: block; min-width: 0; width: 100%;\" value=\"\" /></div></div>"
    },
    {
      "id": "card",
      "name": "Card",
      "aliases": ["panel", "container"],
      "description": "Cards contain content and actions about a single subject.",
      "category": "surface",
      "previewUrl": "previews/mui-v5/card.png",
      "html": "<div style=\"background-color: #fff; color: rgba(0, 0, 0, 0.87); transition: box-shadow 300ms cubic-bezier(0.4, 0, 0.2, 1) 0ms; border-radius: 4px; box-shadow: 0px 2px 1px -1px rgba(0,0,0,0.2), 0px 1px 1px 0px rgba(0,0,0,0.14), 0px 1px 3px 0px rgba(0,0,0,0.12); overflow: hidden; padding: 16px; min-width: 200px;\"><h3 style=\"margin: 0 0 8px 0; font-family: Roboto, sans-serif; font-weight: 500; font-size: 20px; line-height: 1.6; letter-spacing: 0.0075em;\">Card Title</h3><p style=\"margin: 0; font-family: Roboto, sans-serif; font-weight: 400; font-size: 14px; line-height: 1.43; letter-spacing: 0.01071em; color: rgba(0, 0, 0, 0.6);\">Card content goes here</p></div>"
    },
    {
      "id": "chip",
      "name": "Chip",
      "aliases": ["tag", "badge-label"],
      "description": "Chips are compact elements that represent an input, attribute, or action.",
      "category": "display",
      "previewUrl": "previews/mui-v5/chip.png",
      "html": "<div style=\"max-width: 100%; font-family: Roboto, sans-serif; font-size: 13px; display: inline-flex; align-items: center; justify-content: center; height: 32px; color: rgba(0, 0, 0, 0.87); background-color: rgba(0, 0, 0, 0.08); border-radius: 16px; white-space: nowrap; transition: background-color 300ms cubic-bezier(0.4, 0, 0.2, 1) 0ms, box-shadow 300ms cubic-bezier(0.4, 0, 0.2, 1) 0ms; cursor: default; outline: 0; text-decoration: none; border: 0; padding: 0; vertical-align: middle; box-sizing: border-box;\"><span style=\"overflow: hidden; text-overflow: ellipsis; padding-left: 12px; padding-right: 12px; white-space: nowrap;\">Chip</span></div>"
    },
    {
      "id": "alert",
      "name": "Alert",
      "aliases": ["notification", "message", "banner"],
      "description": "An alert displays a short, important message in a way that attracts the user's attention without interrupting the user's task.",
      "category": "feedback",
      "previewUrl": "previews/mui-v5/alert.png",
      "html": "<div style=\"background-color: rgb(237, 247, 237); display: flex; padding: 6px 16px; font-family: Roboto, sans-serif; font-weight: 400; font-size: 14px; line-height: 1.43; border-radius: 4px; letter-spacing: 0.01071em; color: rgb(30, 70, 32); align-items: center;\"><div style=\"margin-right: 12px; padding: 7px 0; display: flex; font-size: 22px; opacity: 0.9;\">âœ“</div><div style=\"padding: 8px 0; min-width: 0; overflow: auto;\">This is a success alert</div></div>"
    }
  ]
}
