{
  "id": "mock-ds5",
  "name": "Mock DS5",
  "version": "5.0",
  "description": "Mock design system for testing search functionality",
  "sourceUrl": "https://example.com/mock-ds5",
  "components": [
    {
      "id": "cta-button",
      "name": "CtaButton",
      "aliases": ["button", "btn", "action-button"],
      "description": "CTA button component",
      "category": "input",
      "previewUrl": "previews/mock-ds5/cta-button.png",
      "html": "<div>this is mock</div>"
    },
    {
      "id": "search-input",
      "name": "SearchInput",
      "aliases": ["textfield", "input", "text-input"],
      "description": "Search text input",
      "category": "input",
      "previewUrl": "previews/mock-ds5/search-input.png",
      "html": "<div>this is mock</div>"
    },
    {
      "id": "on-off-switch",
      "name": "OnOffSwitch",
      "aliases": ["toggle", "switch"],
      "description": "Toggle switch control",
      "category": "input",
      "previewUrl": "previews/mock-ds5/on-off-switch.png",
      "html": "<div>this is mock</div>"
    },
    {
      "id": "container-box",
      "name": "ContainerBox",
      "aliases": ["card", "panel", "surface"],
      "description": "Content container",
      "category": "surface",
      "previewUrl": "previews/mock-ds5/container-box.png",
      "html": "<div>this is mock</div>"
    },
    {
      "id": "message-banner",
      "name": "MessageBanner",
      "aliases": ["notification", "alert", "banner", "toast"],
      "description": "Message notification banner",
      "category": "feedback",
      "previewUrl": "previews/mock-ds5/message-banner.png",
      "html": "<div>this is mock</div>"
    },
    {
      "id": "segmented-tabs",
      "name": "SegmentedTabs",
      "aliases": ["tabs", "tab-bar", "segmented-control"],
      "description": "Segmented tab navigation",
      "category": "navigation",
      "previewUrl": "previews/mock-ds5/segmented-tabs.png",
      "html": "<div>this is mock</div>"
    }
  ]
}
